{
  "requestId": "11111111-1111-4111-8111-111111111111",
  "asin": "B0FIXTURE1",
  "cached": false,
  "generatedAt": "2026-09-20T04:11:00Z",
  "product": {
    "brand": "Demo Masala Co.",
    "name": "Garam Masala Blend",
    "category": "spices_blends",
    "netQuantity": "100 g",
    "fssaiLicense": "10012345678901",
    "isFoodProduct": true,
    "imageUrl": null
  },
  "verdict": {
    "status": "CRITICAL",
    "score": 18,
    "headline": "Batches of this blend were recalled overseas for ethylene oxide",
    "summary": "Regulators in two jurisdictions withdrew specific batches of this masala blend after detecting ethylene oxide, a pesticide not permitted on spices in the EU. A separate sampling report found pesticide residue above the Indian permitted limit. Check the batch code on your pack against the list below before using it."
  },
  "findings": [
    {
      "id": "f1",
      "severity": "CRITICAL",
      "type": "CONTAMINANT",
      "scope": "BATCH",
      "title": "Ethylene oxide detected above the EU maximum residue limit",
      "detail": "A border-control sampling of this blend reported ethylene oxide at 0.24 mg/kg against an EU limit of 0.1 mg/kg. The notification covers the batch codes listed here; packs outside these batches were not part of the withdrawal.",
      "batches": ["E24/09", "E24/11"],
      "citations": [
        {
          "label": "RASFF 2024.XXXX",
          "issuer": "EU RASFF",
          "date": "2024-04-22",
          "sourceUrl": "https://webgate.ec.europa.eu/rasff-window/screen/notification/XXXXXX",
          "s3Uri": "s3://bitecheck-corpus/rasff/2024-XXXX.md",
          "excerpt": "ethylene oxide (0.24 mg/kg - ppm) in spice blend from India"
        }
      ]
    },
    {
      "id": "f2",
      "severity": "HIGH",
      "type": "RECALL",
      "scope": "BRAND",
      "title": "Voluntary withdrawal ordered by an overseas food safety authority",
      "detail": "The importing country's centre for food safety instructed distributors to stop sale and remove affected lots from shelves, citing the same contaminant.",
      "batches": [],
      "citations": [
        {
          "label": "CFS Food Alert FA-XXXX",
          "issuer": "HK CFS",
          "date": "2024-04-21",
          "sourceUrl": "https://www.cfs.gov.hk/english/unsafe_food_alert/",
          "s3Uri": "s3://bitecheck-corpus/hkcfs/fa-XXXX.md",
          "excerpt": "The Centre for Food Safety today instructed the trade to stop sale of the affected batches."
        }
      ]
    }
  ],
  "nutrition": {
    "basis": "per_100g",
    "confidence": "MEDIUM",
    "source": "openfoodfacts",
    "macros": [
      { "key": "carbohydrate", "label": "Carbs", "grams": 41.2, "pct": 41.2, "class": "NEUTRAL" },
      { "key": "fat", "label": "Fat", "grams": 15.0, "pct": 15.0, "class": "NEUTRAL" },
      { "key": "protein", "label": "Protein", "grams": 13.5, "pct": 13.5, "class": "GOOD" },
      { "key": "fiber", "label": "Fibre", "grams": 22.1, "pct": 22.1, "class": "GOOD" },
      { "key": "sodium", "label": "Sodium", "grams": 1.2, "pct": 1.2, "class": "WATCH" },
      { "key": "other", "label": "Unspecified", "grams": 7.0, "pct": 7.0, "class": "UNKNOWN" }
    ],
    "flags": [
      { "code": "INCOMPLETE_LABEL", "label": "Listing image does not show a readable batch code or packing date" }
    ],
    "additives": [],
    "novaGroup": 3
  },
  "alternatives": [
    {
      "brand": "Demo Organics",
      "name": "Garam Masala (batch-tested)",
      "why": "Publishes per-batch pesticide residue reports and carries no adverse regulator records in our corpus.",
      "asin": null
    }
  ],
  "grievance": { "eligible": true, "reason": null },
  "meta": {
    "latencyMs": 4120,
    "chunksRetrieved": 8,
    "findingsDropped": 1,
    "modelId": "fixture",
    "nutritionSource": "openfoodfacts"
  },
  "disclaimer": "Informational only, compiled from public regulator records. Not a laboratory result for the specific pack you are viewing. Always check the batch code printed on your package."
}
